<?xml version="1.0" encoding="UTF-8"?>
<!--
   Copyright 2016 Anyware Services

   Licensed under the Apache License, Version 2.0 (the "License");
   you may not use this file except in compliance with the License.
   You may obtain a copy of the License at

       http://www.apache.org/licenses/LICENSE-2.0

   Unless required by applicable law or agreed to in writing, software
   distributed under the License is distributed on an "AS IS" BASIS,
   WITHOUT WARRANTIES OR CONDITIONS OF ANY KIND, either express or implied.
   See the License for the specific language governing permissions and
   limitations under the License.
   -->
<ribbon  xmlns:xsi="http://www.w3.org/2001/XMLSchema-instance"
          xsi:noNamespaceSchemaLocation="http://ametys.org/cms/3.0/ribbon.xsd">

	<tabs>
       <tab label="RIBBON_LABEL">
           <groups>
               <group label="RIBBON_GROUP_LABEL" icon="">
                    <large>
                        <control id="org.ametys.plugins.workspace-generator-test.control1"/>
                    </large>
                </group>
            </groups>
        </tab>
       <tab label="RIBBON_LABEL">
           <groups>
               <group label="RIBBON_GROUP_LABEL" icon="">
                    <control id="org.ametys.plugins.workspace-generator-test.control2"/>
                </group>
            </groups>
        </tab>
       <tab label="RIBBON_LABEL">
           <groups>
               <group label="RIBBON_GROUP_LABEL" icon="">
                    <control id="org.ametys.plugins.workspace-generator-test.control3"/>
                    <control id="org.ametys.plugins.workspace-generator-test.control3"/>
                    <control id="org.ametys.plugins.workspace-generator-test.control3"/>
                    <control id="org.ametys.plugins.workspace-generator-test.control3"/>
                    <control id="org.ametys.plugins.workspace-generator-test.control3"/>
                    <control id="org.ametys.plugins.workspace-generator-test.control3"/>
                    <control id="org.ametys.plugins.workspace-generator-test.control3"/>
                    <control id="org.ametys.plugins.workspace-generator-test.control3"/>
                </group>
            </groups>
        </tab>
       <tab label="RIBBON_LABEL">
           <groups>
               <group label="RIBBON_GROUP_LABEL" icon="">
                    <large>
                        <control id="org.ametys.plugins.workspace-generator-test.control4"/>
                    </large>
                    <medium>
                        <control id="org.ametys.plugins.workspace-generator-test.control4"/>
                    </medium>
                    <small>
                        <control id="org.ametys.plugins.workspace-generator-test.control4"/>
                    </small>
                </group>
            </groups>
        </tab>
    </tabs>
</ribbon>
